{
  "fund_id": "cobas",
  "fund_name": "Cobas Selección",
  "quarter": "2026-Q1",
  "extracted_at": "2026-04-20T10:00:00Z",
  "extraction_model": "claude-sonnet-4-6",
  "source_url": "https://cobasam.com/q1-2026.pdf",
  "fund_return_pct": 4.2,
  "aum_eur": 2100000000,
  "positions": [
    {
      "company_name": "Atalaya Mining",
      "ticker": "ATYM.L",
      "ticker_status": "verified",
      "weight_pct": 7.3,
      "action": "maintained",
      "upside_pct": 45,
      "thesis_text": "Cobre estructuralmente escaso."
    }
  ]
}
